{
  "capsule_id": "87654321-4321-8765-4321-876543218765",
  "created_at": "2026-09-24T02:05:00.000Z",
  "nonce": "abcdef0123456789",
  "schema": "sip.capsule_checkpoint.v1",
  "sequence_number": 1,
  "state_hash": "cf23df2207d99a74fbe169e3eba035e633b65d947b0c407150033ad88f01bba2",
  "task_id": "12345678-1234-5678-1234-567812345678"
}